{
  "format": 1,
  "name": "web.download-receipt.request",
  "description": "The request the web client sends to download the receipt of an order",
  "request": {
    "method": "GET",
    "path": "/orders/ord_demo1/receipt",
    "headers": {
      "accept": "application/json",
      "authorization": "<token:customer-1>"
    }
  },
  "secret": {
    "request.headers.authorization": "<token:customer-1>"
  }
}
