{
  "format": 1,
  "name": "web.place-order.request",
  "description": "The request the web client sends to place an order",
  "request": {
    "method": "POST",
    "path": "/orders",
    "headers": {
      "accept": "application/json",
      "authorization": "<token:customer-1>",
      "content-type": "application/json"
    },
    "body": {
      "sku": "tea-100",
      "quantity": 1
    }
  },
  "secret": {
    "request.headers.authorization": "<token:customer-1>"
  }
}
